<?xml version="1.0" ?>
<!-- Single configuration file for an activity. -->
<!-- <!DOCTYPE activity SYSTEM "../activity.dtd"> -->
<activity version="0.1" enabled="yes">
	<meta>
		<name>Ser vs. Estar</name>
		<author>Adriane Boyd</author>
	</meta>
	<client-cfg />
	<!--  this is the UIMA AE configuration for the pipeline -->
	<server-cfg>
		<lang code="es">
			<pre>
				<!-- the pipeline descriptor is looked up in the class path, must begin with / -->
				<pipeline desc="/operators/TreeTagger-SerEstar.xml"/>
			</pre>
		</lang>
	</server-cfg>
</activity>
