<?xml version="1.0" ?>
<!-- Single configuration file for an activity. -->
<!-- <!DOCTYPE activity SYSTEM "../activity.dtd"> -->
<activity version="0.1" enabled="yes">
	<meta>
		<name>Gerunds vs. Infinitives</name>
		<author>Niels Ott</author>
		<author>Ramon Ziai</author>
	</meta>	
	
	<!-- the client configuration will be converted to JavaScript ending up in  the browser  -->
	<client-cfg>
		<!-- enhancement styles for the colorize activity -->
		<entry key="enhancementStyleGER" value="color: #ce6006; font-weight:bold" overridable="yes"/>
		<entry key="enhancementStyleINF" value="color: #8c01c0; font-weight:bold" overridable="yes"/>
		<entry key="enhancementStyleCLU_GERONLY" value="color: #2222ff; font-weight:bold" overridable="yes"/>
		<entry key="enhancementStyleCLU_INFONLY" value="color: #2222ff; font-weight:bold" overridable="yes"/>
		<entry key="enhancementStyleCLU_BOTHMEANSAME" value="color: #2222ff; font-weight:bold" overridable="yes"/>
		<entry key="enhancementStyleCLU_BOTHMEANDIFF" value="color: #2222ff; font-weight:bold" overridable="yes"/>
		<entry key="enhancementStyleCLU_FIXEDEXP" value="color: #2222ff; font-weight:bold" overridable="yes"/>
		<!-- this is the default style for the input box in a cloze activity: -->
		<entry key="clozeDefaultStyle" value="font-weight:bold; width:75px; border:1px solid black; background:white;" overridable="yes"/>
		<!-- the input box in a cloze activity is set to this style if the input was wrong: -->
		<entry key="clozeWrongStyle" value="color: red; font-weight:bold; width:75px; border:1px solid black; background:white;" overridable="yes"/>
		<!-- the input box is replaced by a text of this style if the input was correct: -->
		<entry key="clozeCorrectStyle" value="color: green; font-weight:bold" overridable="yes"/>
		<!-- show hint questionmarks in cloze activity? if so, define their style... -->
		<entry key="clozeShowHints" value="yes" overridable="yes" />
		<entry key="clozeHintStyle" value="font-weight:regular; width:15px; border:1px solid #A0A0A0; background:#E9E9E9; color:#A0A0A0; margin-left:2px;" overridable="yes"/>
		<entry key="clozeHintSolvedStyle" value="color: #22F; font-weight:bold" overridable="yes"/>
	</client-cfg>
	<!--  this is the UIMA AE configuration for the pipeline -->
	<server-cfg>
		<lang code="en">
			<pre>
				<!-- the pipeline descriptor is looked up in the class path, must begin with / -->
				<pipeline desc="/operators/vislcg3Pipe.xml"/>
				<entry key="vislcg3Loc" value="/usr/local/werti/bin/vislcg3" overridable="no"/>
				<!-- relative paths should be interpreted as relative to the respective activity directory -->
				<entry key="vislcg3GrammarLoc" value="_ACT_/resources/gerundsgrammar" overridable="no"/>
                <entry key="vislCGPostProc_chunkTags" value="INF,GER,CLU-GERONLY,CLU-INFONLY,CLU-BOTHMEANSAME,CLU-BOTHMEANDIFF,CLU-FIXEDEXP,PRO,PAR,GOI,GOP,AMB,RELEVANT" overridable="no"/>
			</pre>
		</lang>
	</server-cfg>
</activity>
