<?xml version="1.0" ?>
<!-- Single configuration file for an activity. -->
<!-- <!DOCTYPE activity SYSTEM "../activity.dtd"> -->
<activity version="0.1" enabled="no">
	<meta>
		<name>Passives</name>
		<author>Adriane Boyd</author>
	</meta>
		<!-- the client configuration will be converted to JavaScript ending up in  the browser  -->
	<client-cfg>
	</client-cfg>
	<!--  this is the UIMA AE configuration for the pipeline -->
	<server-cfg>
		<lang code="en">
			<pre>
				<!-- the pipeline descriptor is looked up in the class path, must begin with / -->
				<pipeline desc="/operators/Passives.xml"/>
			</pre>
			<post>
				<pipeline desc="/operators/PassivesPost.xml"/>
			</post>
		</lang>
	</server-cfg>
</activity>
