<?xml version="1.0" ?>
<!-- Single configuration file for an activity. -->
<!-- <!DOCTYPE activity SYSTEM "../activity.dtd"> -->
<activity version="0.1" enabled="yes">
	<meta>
		<name>Phrasal Verbs</name>
		<author>Adriane Boyd</author>
	</meta>
		<!-- the client configuration will be converted to JavaScript ending up in  the browser  -->
	<client-cfg>
		<!-- enhancement styles for the colorize activity -->
		<entry key="enhancementStyleSVI" value="background-color: #E6E6FA; font-weight:bold" overridable="yes"/>
		<entry key="enhancementStyleSVO" value="background-color: #FAEBD7; font-weight:bold" overridable="yes"/>
		<entry key="enhancementStyleWH" value="color: #0000FF; font-weight:bold" overridable="yes"/>
		<entry key="enhancementStyleWHS" value="color: #1E90FF; font-weight:bold" overridable="yes"/>
		<entry key="enhancementStyleAUX" value="color: #FF4500; font-weight:bold" overridable="yes"/>
		<entry key="enhancementStyleMVERB" value="color: #FF4500; font-weight:bold" overridable="yes"/>
		<entry key="enhancementStyleSUBJ" value="color: #808000; font-weight:bold" overridable="yes"/>
		<entry key="enhancementStyleNFIN" value="color: #FF4500; font-weight:bold" overridable="yes"/>
		</client-cfg>
	<!--  this is the UIMA AE configuration for the pipeline -->
	<server-cfg>
		<lang code="en">
			<pre>
				<!-- the pipeline descriptor is looked up in the class path, must begin with / -->
				<pipeline desc="/operators/PhrasalVerbs.xml"/>
			</pre>
		</lang>
	</server-cfg>
</activity>
