<?xml version="1.0" ?>
<!-- Single configuration file for an activity. -->
<!-- <!DOCTYPE activity SYSTEM "../activity.dtd"> -->
<activity version="0.1" enabled="yes">
	<meta>
		<name>Noun Countability</name>
		<author>Adriane Boyd</author>
	</meta>	
	<!-- the client configuration will be converted to JavaScript ending up in  the browser  -->
	<client-cfg>
	</client-cfg>
	<!--  this is the UIMA AE configuration for the pipeline -->
	<server-cfg>
		<lang code="en">
			<pre>
				<!-- the pipeline descriptor is looked up in the class path, must begin with / -->
				<pipeline desc="/operators/OpenNlpChunkerPipe.xml"/>
				<!--  <entry key="port" value="7000" overridable="no"/>
				<entry key="featureExtractor" value="werti.ml.fe.NounCountabilityFeatureExtractor" overridable="no"/>
				<entry key="sparseFeatures" value="false" overridable="no"/>
				<entry key="featureSeparator" value="," overridable="no"/>
				<entry key="posFilter" value="^NNS?$" overridable="no"/> -->
                <entry key="NounCountEnhancer_tags" value="COUNT,NONCOUNT,BOTH" overridable="no"/>
                <entry key="NounCountEnhancer_countFile" value="_ACT_/resources/count.txt" overridable="no"/>
                <entry key="NounCountEnhancer_noncountFile" value="_ACT_/resources/noncount.txt" overridable="no"/>
                <entry key="NounCountEnhancer_bothFile" value="_ACT_/resources/both.txt" overridable="no"/>
                <entry key="NounCountEnhancer_posFilter" value="^NNS?$" overridable="no"/>
			</pre>
		</lang>
	</server-cfg>
</activity>
